{
  "collection_id": "EVIDENCE-COLLECTION-20260702",
  "evidence": [
    {
      "category": "etf_flow",
      "evidence_id": "PROVIDER-ETF-SMH-FLOW-20260702",
      "importance": 78,
      "market": "US",
      "model_impact": "evidence_only_not_production",
      "provider": "etf",
      "reference": "provider://etf/SMH/flow/2026-07-02",
      "reliability": 86,
      "repository_write_authorized": false,
      "source": "archived_replay_fixture",
      "status": "runtime_evidence_candidate",
      "symbol": "SMH",
      "timestamp": "2026-07-02T20:10:00+00:00"
    },
    {
      "category": "currency_index",
      "evidence_id": "PROVIDER-MACRO-DXY-20260702",
      "importance": 80,
      "market": "MACRO",
      "model_impact": "evidence_only_not_production",
      "provider": "macro",
      "reference": "provider://macro/DXY/2026-07-02",
      "reliability": 93,
      "repository_write_authorized": false,
      "source": "archived_replay_fixture",
      "status": "runtime_evidence_candidate",
      "symbol": "DXY",
      "timestamp": "2026-07-02T20:06:00+00:00"
    },
    {
      "category": "bond_yield",
      "evidence_id": "PROVIDER-MACRO-US10Y-20260702",
      "importance": 88,
      "market": "MACRO",
      "model_impact": "evidence_only_not_production",
      "provider": "macro",
      "reference": "provider://macro/US10Y/2026-07-02",
      "reliability": 95,
      "repository_write_authorized": false,
      "source": "archived_replay_fixture",
      "status": "runtime_evidence_candidate",
      "symbol": "US10Y",
      "timestamp": "2026-07-02T20:05:00+00:00"
    },
    {
      "category": "crypto_close",
      "evidence_id": "PROVIDER-MOCK-BTC-20260702",
      "importance": 65,
      "market": "CRYPTO",
      "model_impact": "evidence_only_not_production",
      "provider": "mock",
      "reference": "provider://mock/BTC-USD/2026-07-02",
      "reliability": 60,
      "repository_write_authorized": false,
      "source": "archived_replay_fixture",
      "status": "runtime_evidence_candidate",
      "symbol": "BTC-USD",
      "timestamp": "2026-07-02T20:16:00+00:00"
    },
    {
      "category": "global_risk_context",
      "evidence_id": "PROVIDER-MOCK-GLOBAL-RISK-20260702",
      "importance": 70,
      "market": "GLOBAL",
      "model_impact": "evidence_only_not_production",
      "provider": "mock",
      "reference": "provider://mock/global-risk/2026-07-02",
      "reliability": 60,
      "repository_write_authorized": false,
      "source": "archived_replay_fixture",
      "status": "runtime_evidence_candidate",
      "symbol": "GLOBAL",
      "timestamp": "2026-07-02T20:15:00+00:00"
    },
    {
      "category": "company_capex_context",
      "evidence_id": "PROVIDER-NEWS-AI-CAPEX-20260702",
      "importance": 75,
      "market": "GLOBAL",
      "model_impact": "evidence_only_not_production",
      "provider": "news",
      "reference": "provider://news/ai-capex/2026-07-02",
      "reliability": 70,
      "repository_write_authorized": false,
      "source": "archived_replay_fixture",
      "status": "runtime_evidence_candidate",
      "symbol": "AI-INFRA",
      "timestamp": "2026-07-02T18:30:00+00:00"
    },
    {
      "category": "theme_turnover",
      "evidence_id": "PROVIDER-TW-AI-TURNOVER-20260702",
      "importance": 82,
      "market": "TAIWAN",
      "model_impact": "evidence_only_not_production",
      "provider": "taiwan",
      "reference": "provider://taiwan/theme/ai-supply-chain/2026-07-02",
      "reliability": 88,
      "repository_write_authorized": false,
      "source": "archived_replay_fixture",
      "status": "runtime_evidence_candidate",
      "symbol": "AI-SUPPLY-CHAIN",
      "timestamp": "2026-07-02T05:31:00+00:00"
    },
    {
      "category": "index_close",
      "evidence_id": "PROVIDER-TW-TAIEX-20260702",
      "importance": 90,
      "market": "TAIWAN",
      "model_impact": "evidence_only_not_production",
      "provider": "taiwan",
      "reference": "provider://taiwan/TAIEX/2026-07-02",
      "reliability": 95,
      "repository_write_authorized": false,
      "source": "archived_replay_fixture",
      "status": "runtime_evidence_candidate",
      "symbol": "TAIEX",
      "timestamp": "2026-07-02T05:30:00+00:00"
    },
    {
      "category": "semiconductor_index",
      "evidence_id": "PROVIDER-US-SOX-20260702",
      "importance": 94,
      "market": "US",
      "model_impact": "evidence_only_not_production",
      "provider": "us",
      "reference": "provider://us/SOX/2026-07-02",
      "reliability": 94,
      "repository_write_authorized": false,
      "source": "archived_replay_fixture",
      "status": "runtime_evidence_candidate",
      "symbol": "SOX",
      "timestamp": "2026-07-02T20:01:00+00:00"
    },
    {
      "category": "index_close",
      "evidence_id": "PROVIDER-US-SPX-20260702",
      "importance": 92,
      "market": "US",
      "model_impact": "evidence_only_not_production",
      "provider": "us",
      "reference": "provider://us/SPX/2026-07-02",
      "reliability": 96,
      "repository_write_authorized": false,
      "source": "archived_replay_fixture",
      "status": "runtime_evidence_candidate",
      "symbol": "SPX",
      "timestamp": "2026-07-02T20:00:00+00:00"
    }
  ],
  "evidence_count": 10,
  "generated_at": "2026-07-02T21:00:00+00:00",
  "manual_entry": false,
  "production_authorized": false,
  "repository_write_authorized": false,
  "snapshot_ref": "MARKET-SNAPSHOT-20260702",
  "status": "shadow_evidence_collection"
}
